{
  "$id": "https://sdlc.local/schemas/repro-proof.schema.json",
  "$schema": "https://json-schema.org/draft/2020-12/schema",
  "type": "object",
  "properties": {
    "schema": {
      "type": "number",
      "const": 1
    },
    "testPath": {
      "type": "string",
      "minLength": 1
    },
    "failureReason": {
      "type": "string",
      "minLength": 1
    },
    "sha": {
      "type": "string",
      "pattern": "^[0-9a-f]{40}(?:[0-9a-f]{24})?$"
    },
    "output": {
      "type": "string"
    },
    "confirmedBy": {
      "type": "string",
      "minLength": 1
    },
    "confirmedAt": {
      "type": "string",
      "format": "date-time",
      "pattern": "^(?:(?:\\d\\d[2468][048]|\\d\\d[13579][26]|\\d\\d0[48]|[02468][048]00|[13579][26]00)-02-29|\\d{4}-(?:(?:0[13578]|1[02])-(?:0[1-9]|[12]\\d|3[01])|(?:0[469]|11)-(?:0[1-9]|[12]\\d|30)|(?:02)-(?:0[1-9]|1\\d|2[0-8])))T(?:(?:[01]\\d|2[0-3]):[0-5]\\d:[0-5]\\d(?:\\.\\d+)?(?:Z|([+-](?:[01]\\d|2[0-3]):[0-5]\\d)))$"
    }
  },
  "required": [
    "schema",
    "testPath",
    "failureReason",
    "sha",
    "output",
    "confirmedBy",
    "confirmedAt"
  ],
  "additionalProperties": false
}
